{
  "listing_id": "ls-tmall-20250620-001",
  "source_id": "tmall-20250620-001",
  "product_master_id": "pm-example-1",
  "product_version_id": "pv-example-1",
  "title": "Example Corp PM-Extra 500mg 30 Tablets - Official Store",
  "price": 129.00,
  "currency": "CNY",
  "original_price": "¥129.00",
  "price_type": "list_price",
  "price_condition": "first_order_only",
  "package_size": "30 tablets",
  "package_quantity": 30,
  "seller_type": "official_brand",
  "seller_name": "Example Corp Official Store",
  "seller_region": "CN",
  "platform_metrics": ["pm-tmall-20250620-001", "pm-tmall-20250620-002"],
  "in_stock": true,
  "shipping_region": "CN",
  "shipping_cost": 0,
  "shipping_currency": "CNY",
  "collection_date": "2025-06-20",
  "collection_datetime": "2025-06-20T14:30:00+08:00",
  "page_position": "search_result_1",
  "data_quality_notes": "Login required to see member price. List price collected from public page.",
  "record_version": 1
}
